{
  "set": "part5-core",
  "part": 5,
  "version": 1,
  "entries": [
    {
      "id": "p5-0001",
      "set": "part5-core",
      "part": 5,
      "status": "active",
      "stem": "The city council has granted the local authority the power to ---- the zoning regulations for the upcoming commercial development project in the downtown area.",
      "options": {
        "A": "amend",
        "B": "abolish",
        "C": "enforce",
        "D": "suspend"
      },
      "answer": "A",
      "errorType": "vocabulary",
      "explanation": "Trong ngữ cảnh pháp lý và quy hoạch đô thị, 'amend' (sửa đổi) là từ phù hợp nhất để chỉ việc điều chỉnh các quy định hiện hành.",
      "trap": "Các từ 'enforce' (thực thi) hoặc 'abolish' (bãi bỏ) nghe có vẻ hợp lý về mặt ngữ pháp nhưng không phản ánh đúng logic của việc điều chỉnh quy hoạch.",
      "gen": {
        "model": "gemini-3.1-flash-lite",
        "promptVersion": "part5-v3",
        "batch": "2026-09-19",
        "date": "2026-09-19"
      },
      "verify": {
        "model": "gemini-flash-lite-latest",
        "answer": "A",
        "agreed": true
      }
    },
    {
      "id": "p5-0002",
      "set": "part5-core",
      "part": 5,
      "status": "active",
      "stem": "The maintenance crew discovered that the faulty lamp in the lobby was ---- due to a persistent moisture issue within the ceiling structure.",
      "options": {
        "A": "corroding",
        "B": "corroded",
        "C": "corrosion",
        "D": "corrosive"
      },
      "answer": "B",
      "errorType": "word-form",
      "explanation": "Cấu trúc 'was + V-ed' cần thiết để diễn tả trạng thái bị động của cái đèn do tác động bên ngoài.",
      "trap": "Người học có thể chọn 'corroding' vì nghĩ rằng cái đèn đang tự hỏng, nhưng thực tế nó là đối tượng chịu tác động.",
      "gen": {
        "model": "gemini-3.1-flash-lite",
        "promptVersion": "part5-v3",
        "batch": "2026-09-19",
        "date": "2026-09-19"
      },
      "verify": {
        "model": "gemini-flash-lite-latest",
        "answer": "B",
        "agreed": true
      }
    },
    {
      "id": "p5-0003",
      "set": "part5-core",
      "part": 5,
      "status": "active",
      "stem": "The investigative journalism team has been working tirelessly to uncover evidence that the corporation ---- its financial reports for several consecutive fiscal years.",
      "options": {
        "A": "falsifies",
        "B": "has falsified",
        "C": "had falsified",
        "D": "was falsifying"
      },
      "answer": "B",
      "errorType": "verb-tense",
      "explanation": "Sử dụng thì hiện tại hoàn thành để diễn tả một hành động kéo dài từ quá khứ đến hiện tại, phù hợp với cụm 'for several consecutive fiscal years'.",
      "trap": "Người học dễ chọn 'had falsified' vì nghĩ rằng hành động đã kết thúc, nhưng câu này ám chỉ hậu quả vẫn còn liên quan đến hiện tại.",
      "gen": {
        "model": "gemini-3.1-flash-lite",
        "promptVersion": "part5-v3",
        "batch": "2026-09-19",
        "date": "2026-09-19"
      },
      "verify": {
        "model": "gemini-flash-lite-latest",
        "answer": "B",
        "agreed": true
      }
    },
    {
      "id": "p5-0004",
      "set": "part5-core",
      "part": 5,
      "status": "active",
      "stem": "Please ensure that your team updates the project calendar ---- so that all departments remain aligned with the revised delivery schedule for the software launch.",
      "options": {
        "A": "repeatedly",
        "B": "consecutively",
        "C": "accordingly",
        "D": "frequently"
      },
      "answer": "C",
      "errorType": "vocabulary",
      "explanation": "Trạng từ 'accordingly' (một cách phù hợp) là lựa chọn chính xác nhất để chỉ việc cập nhật lịch sao cho khớp với tiến độ mới.",
      "trap": "Từ 'repeatedly' (lặp đi lặp lại) gây nhiễu vì người học nghĩ rằng cần cập nhật nhiều lần, nhưng 'accordingly' mới là từ chỉ sự logic.",
      "gen": {
        "model": "gemini-3.1-flash-lite",
        "promptVersion": "part5-v3",
        "batch": "2026-09-19",
        "date": "2026-09-19"
      },
      "verify": {
        "model": "gemini-flash-lite-latest",
        "answer": "C",
        "agreed": true
      }
    },
    {
      "id": "p5-0005",
      "set": "part5-core",
      "part": 5,
      "status": "active",
      "stem": "The major retailer has decided to close its flagship store because the operating costs ---- the revenue generated from local sales in that specific region.",
      "options": {
        "A": "exceed",
        "B": "exceeded",
        "C": "have exceeded",
        "D": "are exceeding"
      },
      "answer": "A",
      "errorType": "subject-verb-agreement",
      "explanation": "Chủ ngữ 'operating costs' là số nhiều, nên động từ phải chia ở dạng số nhiều 'exceed' để diễn tả một sự thật hiển nhiên.",
      "trap": "Người học dễ bị lừa bởi các thì quá khứ hoặc hiện tại tiếp diễn nếu không nhận ra đây là một sự thật khách quan dẫn đến quyết định đóng cửa.",
      "gen": {
        "model": "gemini-3.1-flash-lite",
        "promptVersion": "part5-v3",
        "batch": "2026-09-19",
        "date": "2026-09-19"
      },
      "verify": {
        "model": "gemini-flash-lite-latest",
        "answer": "A",
        "agreed": true
      }
    },
    {
      "id": "p5-0006",
      "set": "part5-core",
      "part": 5,
      "status": "active",
      "stem": "The safety inspector noted that the warehouse staff ---- the hazardous materials in the designated area without wearing the required protective gear.",
      "options": {
        "A": "handle",
        "B": "handled",
        "C": "have handled",
        "D": "are handling"
      },
      "answer": "B",
      "errorType": "verb-tense",
      "explanation": "Động từ 'noted' ở quá khứ đòi hỏi hành động được quan sát cũng phải ở quá khứ đơn 'handled'.",
      "trap": "Người học có thể chọn 'handle' vì nghĩ đến thói quen, nhưng ngữ cảnh 'inspector noted' yêu cầu sự nhất quán về thì.",
      "gen": {
        "model": "gemini-3.1-flash-lite",
        "promptVersion": "part5-v3",
        "batch": "2026-09-19",
        "date": "2026-09-19"
      },
      "verify": {
        "model": "gemini-flash-lite-latest",
        "answer": "B",
        "agreed": true
      }
    },
    {
      "id": "p5-0007",
      "set": "part5-core",
      "part": 5,
      "status": "active",
      "stem": "Each shipping container must have a tracking tag attached to the exterior, ---- it can be easily identified by the automated sorting system.",
      "options": {
        "A": "so that",
        "B": "in case",
        "C": "provided that",
        "D": "as if"
      },
      "answer": "A",
      "errorType": "vocabulary",
      "explanation": "Liên từ 'so that' (để mà) chỉ mục đích, hoàn toàn phù hợp với logic của việc gắn thẻ để hệ thống nhận diện.",
      "trap": "Các từ như 'provided that' (với điều kiện là) nghe có vẻ trang trọng nhưng không diễn tả đúng mục đích của hành động gắn thẻ.",
      "gen": {
        "model": "gemini-3.1-flash-lite",
        "promptVersion": "part5-v3",
        "batch": "2026-09-19",
        "date": "2026-09-19"
      },
      "verify": {
        "model": "gemini-flash-lite-latest",
        "answer": "A",
        "agreed": true
      }
    },
    {
      "id": "p5-0008",
      "set": "part5-core",
      "part": 5,
      "status": "active",
      "stem": "The speaker's intonation during the presentation was so monotone that the audience ---- interest in the topic within the first ten minutes.",
      "options": {
        "A": "lost",
        "B": "had lost",
        "C": "was losing",
        "D": "has lost"
      },
      "answer": "A",
      "errorType": "verb-tense",
      "explanation": "Cấu trúc 'so... that' với 'was' ở quá khứ yêu cầu động từ vế sau cũng phải ở quá khứ đơn 'lost'.",
      "trap": "Người học dễ chọn 'had lost' vì nghĩ hành động đã xảy ra trước, nhưng đây là hệ quả trực tiếp trong quá khứ.",
      "gen": {
        "model": "gemini-3.1-flash-lite",
        "promptVersion": "part5-v3",
        "batch": "2026-09-19",
        "date": "2026-09-19"
      },
      "verify": {
        "model": "gemini-flash-lite-latest",
        "answer": "A",
        "agreed": true
      }
    },
    {
      "id": "p5-0009",
      "set": "part5-core",
      "part": 5,
      "status": "active",
      "stem": "The hazardous waste disposal site will be subject to a thorough inspection, as the local residents have ---- concerns about potential environmental contamination.",
      "options": {
        "A": "raised",
        "B": "rising",
        "C": "arisen",
        "D": "arising"
      },
      "answer": "A",
      "errorType": "vocabulary",
      "explanation": "Cụm collocation 'raised concerns' (nêu lên mối quan ngại) là cách diễn đạt chuẩn mực trong tiếng Anh thương mại.",
      "trap": "Từ 'arisen' (nảy sinh) thường bị nhầm với 'raised' vì nghĩa tương đồng nhưng cách dùng với tân ngữ 'concerns' khác nhau.",
      "gen": {
        "model": "gemini-3.1-flash-lite",
        "promptVersion": "part5-v3",
        "batch": "2026-09-19",
        "date": "2026-09-19"
      },
      "verify": {
        "model": "gemini-flash-lite-latest",
        "answer": "A",
        "agreed": true
      }
    },
    {
      "id": "p5-0010",
      "set": "part5-core",
      "part": 5,
      "status": "active",
      "stem": "The travel agent finalized the itinerary for the executive team, ensuring that all flights and hotel accommodations ---- well in advance of the departure date.",
      "options": {
        "A": "are booked",
        "B": "were booked",
        "C": "had been booked",
        "D": "would be booked"
      },
      "answer": "C",
      "errorType": "verb-tense",
      "explanation": "Thì quá khứ hoàn thành bị động 'had been booked' diễn tả hành động đã hoàn tất trước một mốc thời gian trong quá khứ (finalized).",